{
  "assignments": [
    {
      "bus_id": "BUS.BASS",
      "bus_path": "BUS.MASTER/BUS.BASS",
      "confidence": 0.5,
      "file_path": "stems/bass_di.wav",
      "role_id": "ROLE.BASS.DI",
      "stem_id": "bass_di"
    },
    {
      "bus_id": "BUS.DRUMS.KICK",
      "bus_path": "BUS.MASTER/BUS.DRUMS/BUS.DRUMS.KICK",
      "confidence": 0.75,
      "file_path": "stems/kick.wav",
      "role_id": "ROLE.DRUM.KICK",
      "stem_id": "kick"
    },
    {
      "bus_id": "BUS.MUSIC.SYNTH",
      "bus_path": "BUS.MASTER/BUS.MUSIC/BUS.MUSIC.SYNTH",
      "confidence": 0.333,
      "file_path": "stems/pad_stereo_wide.wav",
      "role_id": "ROLE.SYNTH.PAD",
      "stem_id": "pad_stereo_wide"
    },
    {
      "bus_id": "BUS.FX.SFX",
      "bus_path": "BUS.MASTER/BUS.FX/BUS.FX.SFX",
      "confidence": 0.333,
      "file_path": "stems/sfx_stereo.wav",
      "role_id": "ROLE.SFX.HARD",
      "stem_id": "sfx_stereo"
    }
  ],
  "buses": [
    {
      "bus_id": "BUS.BASS",
      "children_ids": [],
      "label": "Bass",
      "parent_id": "BUS.MASTER",
      "stem_ids": [
        "bass_di"
      ]
    },
    {
      "bus_id": "BUS.DRUMS",
      "children_ids": [
        "BUS.DRUMS.KICK"
      ],
      "label": "Drums",
      "parent_id": "BUS.MASTER",
      "stem_ids": [
        "kick"
      ]
    },
    {
      "bus_id": "BUS.DRUMS.KICK",
      "children_ids": [],
      "label": "Drums Kick",
      "parent_id": "BUS.DRUMS",
      "stem_ids": [
        "kick"
      ]
    },
    {
      "bus_id": "BUS.FX",
      "children_ids": [
        "BUS.FX.SFX"
      ],
      "label": "Fx",
      "parent_id": "BUS.MASTER",
      "stem_ids": [
        "sfx_stereo"
      ]
    },
    {
      "bus_id": "BUS.FX.SFX",
      "children_ids": [],
      "label": "Fx Sfx",
      "parent_id": "BUS.FX",
      "stem_ids": [
        "sfx_stereo"
      ]
    },
    {
      "bus_id": "BUS.MASTER",
      "children_ids": [
        "BUS.DRUMS",
        "BUS.BASS",
        "BUS.MUSIC",
        "BUS.FX"
      ],
      "label": "Master",
      "parent_id": null,
      "stem_ids": [
        "bass_di",
        "kick",
        "pad_stereo_wide",
        "sfx_stereo"
      ]
    },
    {
      "bus_id": "BUS.MUSIC",
      "children_ids": [
        "BUS.MUSIC.SYNTH"
      ],
      "label": "Music",
      "parent_id": "BUS.MASTER",
      "stem_ids": [
        "pad_stereo_wide"
      ]
    },
    {
      "bus_id": "BUS.MUSIC.SYNTH",
      "children_ids": [],
      "label": "Music Synth",
      "parent_id": "BUS.MUSIC",
      "stem_ids": [
        "pad_stereo_wide"
      ]
    }
  ],
  "generated_utc": "1970-01-01T00:00:00Z",
  "schema": "mmo.bus_plan.v1",
  "source": {
    "roles_ref": "ontology/roles.yaml",
    "stems_map_ref": "stems_map.json"
  },
  "summary": {
    "bus_counts": {
      "BUS.BASS": 1,
      "BUS.DRUMS.KICK": 1,
      "BUS.FX.SFX": 1,
      "BUS.MUSIC.SYNTH": 1
    },
    "role_counts": {
      "ROLE.BASS.DI": 1,
      "ROLE.DRUM.KICK": 1,
      "ROLE.SFX.HARD": 1,
      "ROLE.SYNTH.PAD": 1
    }
  }
}
